{"accepted_gate_head_sha":"fc727d78fc38a70e7bef7c85fb22d3e8fe2c7006","container_path":"data/normalized/l1_yahoo_daily_v1.json","container_sha256":"6608c0ef88f4b7edaef7523738d7a172215aa4f97c8c403adeba884d6582a4dd","cutoff_inclusive":"2015-12-31","gate_id":"l_4_breadth_b88r5_phase_a_execution_contract_v6","gate_sha256":"e0e1953c8c179416623565e0524c121d0e7adc845b9e636299f0ef8875c2fa74","hermetic_ci_head_sha":"fc727d78fc38a70e7bef7c85fb22d3e8fe2c7006","hermetic_ci_run_id":30806980165,"inspector_decision":"ACCEPTED","marker_path":"reports/experiments/l_4_breadth_b88r5_one_shot_marker_v6.json","owner_literal":"continue the work till we complete L4","schema_version":"lily_l4_b88r5_activation_v6","structural_manifest_path":"experiments/provisioned/l_4_breadth_b86r13_falsification_manifest_v15.json","structural_manifest_sha256":"de00a4b5a5dd732e27a4a9900868a0f696bb80794e04924da9187808311bb008","u8_members_in_order":["VTI","VGK","EWJ","VWO","IEF","TIP","GLD","DBC"],"u8_sessions_path":"experiments/provisioned/l_4_breadth_b86r13_u8_session_dates_v15.json","u8_sessions_sha256":"f95665db8ad78280433b37e646486ba03954d0eccba13538d41e961ea88c94ef","validation_seal":{"accessed":false,"status":"sealed_not_accessed"}}